{"device_execution":{"choices":[{"backend":"cpu-parallel","function":"main","implementation":"cpu-lsd-radix-4x8","kind":"Sort","reason":"cuda-feature-unavailable","span":{"end":223,"start":198}},{"backend":"cpu-parallel","function":"main","implementation":"cpu-lsd-radix-4x8","kind":"Sort","reason":"cuda-feature-unavailable","span":{"end":254,"start":241}},{"backend":"cpu-parallel","function":"main","implementation":"cpu-lsd-radix-4x8","kind":"Sort","reason":"cuda-feature-unavailable","span":{"end":402,"start":369}},{"backend":"cpu-parallel","function":"main","implementation":"cpu-lsd-radix-4x8","kind":"Sort","reason":"cuda-feature-unavailable","span":{"end":495,"start":483}}],"module_cache_hits":0,"requested_engine":"auto","result":7,"schedule_hint_hits":0,"schedule_hint_invalids":0},"device_schema":"invar-explain-device-v2","diagnostics":[],"explicit_sorts":[{"default_implementation":"cpu-lsd-radix-4x8","function":"main","operation":"sort_by_key","reason":"sort-cost-unmeasured","rule":"explicit-stable-sort-v1","span":{"end":223,"start":198}},{"default_implementation":"cpu-lsd-radix-4x8","function":"main","operation":"argsort","reason":"sort-cost-unmeasured","rule":"explicit-stable-sort-v1","span":{"end":254,"start":241}},{"default_implementation":"cpu-lsd-radix-4x8","function":"main","operation":"segmented_sort","reason":"sort-cost-unmeasured","rule":"explicit-stable-sort-v1","span":{"end":402,"start":369}},{"default_implementation":"cpu-lsd-radix-4x8","function":"main","operation":"sort","reason":"sort-cost-unmeasured","rule":"explicit-stable-sort-v1","span":{"end":495,"start":483}}],"regions":[],"schema":"invar-explain-v2","schema_version":2,"source_identity":"fnv1a64:cc8a11d93eb09233","status":"ok"}
